Titles,Links
Brittney Griner lands in US after prisoner swap,Brittney Griner lands in US after prisoner swap
US Senator Kyrsten Sinema to leave Democratic Party,US Senator Kyrsten Sinema to leave Democratic Party
Does the Harry and Meghan series live up to the hype?,Does the Harry and Meghan series live up to the hype?
"UK, Italy and Japan team up for new fighter jet","UK, Italy and Japan team up for new fighter jet"
The Indian women calling themselves ‘proudly single’,The Indian women calling themselves ‘proudly single’
Kremlin critic jailed for 'fake news' on Russia war,Kremlin critic jailed for 'fake news' on Russia war
Backstreet Boys show pulled after rape allegation,Backstreet Boys show pulled after rape allegation
Penguin boss resigns after US blocks takeover deal,Penguin boss resigns after US blocks takeover deal
Mumbai air getting worse than smog-filled Delhi,Mumbai air getting worse than smog-filled Delhi
Fired Twitter cleaners 'treated like garbage',Fired Twitter cleaners 'treated like garbage'
