Titles,Date&Time,Images_URL,Article_links,Article_conetent
Is Labour really back in business?,1:45 9 Dec,https://ichef.bbci.co.uk/live-experience/cps/320/cpsprodpb/161F/production/_127936650_mediaitem127936549.jpg,https://www.bbc.com/news/uk-politics-63911618,"Labour has made its latest pitch for power to business leaders at Canary Wharf, one of London's financial hubs. Was it enough to convince them the party is a government-in-waiting?The symbolism was as important as the substance.On the face of it, Labour's business conference in Canary Wharf was to launch a report promoting and encouraging business start-ups.But it was also an opportunity for Labour to promote its pro-business credentials and further highlight its distance from the Corbyn era.Opening the conference, Labour leader Sir Keir Starmer said the party wasn't just pro-business but ""proudly pro-business"".But more importantly, was business now more pro-Labour?Banners were proudly displayed demonstrating backing for the conference from - amongst others - HSBC and energy company SSE.But neither Sir Keir nor Rachel Reeves, the shadow chancellor, could name a single company which was endorsing the party itself for the first time.Ms Reeves told me it was difficult for ""big businesses - certainly public limited companies - to endorse political parties"".But, she said, there had been ""a huge surge in donations"" to Labour from business.The event was partly open to the press but perhaps in a sign of nervousness, some of what Sir Keir described as ""the biggest engagement with businesses in a decade"" took place behind closed doors.A shadow minister was deployed to each table of attendees to discuss the party's plans in greater detail and to listen to concerns.When he was shadow chancellor three decades ago, Labour's John Smith embarked on a ""prawn cocktail"" offensive - City lunches to reassure the financial sector that they need not fear a Labour government.This time, attendees were wooed first by coffee and pastries, then over lunch with a noodle dish and strawberry-and-melon-infused water.Access to the one Labour-supporting business figure told me ""this is all about emphasising we are a serious party of government. We have to ram home over and over again that we are serious about business"".A Conservative-supporting attendee was less impressed with the content, but admired the organisation of the event - and said it reminded him of when former Tory Prime Minister David Cameron was on the cusp of power.But just how frank is Labour's engagement with business?I tested the water during the lunchtime break with Ms Reeves.I asked if the party had been clear that its decision to repeal 2016 trade union legislation - setting thresholds in strike ballots - would make it easier for unions to go on strike.She said the legislation hadn't ""made a blind bit of difference because when working people have had enough, they decide to take industrial action"". But she suggested private businesses were likely to be more reasonable than the government.""The business people who are here today, many of them will recognise trade unions and will work with their workers to resolve disputes,"" she said.Neither she nor Sir Keir would commit to repealing promised - or threatened - Conservative legislation on minimum service levels, stressing that it would do nothing to solve the current disputes.And now that permission has been given to a coal mine in Cumbria, would a pro-business Labour government really close it down if they come to power?""There are plenty of ways to get jobs in Cumbria and the north of England,"" she said. ""I don't think [the mine] will be open by the time of the next election. I'd be amazed if it was open.""Exporting businesses are also keen to get tariff-free access to big markets. Labour has ruled out rejoining the EU single market, the biggest market on the UK's doorstep.Politically, the party does not want to revisit the Brexit divisions of the past at the next election. But was the shadow chancellor - who opposed leaving the EU - really telling businesses that economic growth would be higher outside of the free-trade zone across the Channel?Her emphasis was to improve the Brexit deal rather than turn back the clock.""We recognise that the status quo, the Brexit deal that the government secured three years ago, it is not working for business,"" she said.She said there were ""practical things we can do to improve relations with our nearest neighbours and trading partners and as a government we'd be determined to do that"".Labour insiders know they have an opportunity to convince business that they can provide the stability they crave, though they have no longer been gifted with the contrast of a Liz Truss administration.Ahead in the polls, Labour is putting emphasis on not putting a foot wrong and creating political hostages to fortune.Appearing serious and responsible and appealing to new sources of support is seen as far more necessary than generating headlines."
Council tracks people's phones to monitor footfall,23:14 8 Dec,https://ichef.bbci.co.uk/live-experience/cps/320/cpsprodpb/180E5/production/_127933589_phonespic.jpg,https://www.bbc.com/news/uk-wales-63907208,"A council is using people's mobile phone movements to get an insight into shoppers' habits on high streets.Conwy council's pilot tracks people who use its free wi-fi services as they move around Llandudno's Mostyn Street.The information will inform decisions around business hours and where further investment might be needed.But the issue has sparked fierce debate, with Llandudno councillor Harry Saville raising concerns about how the project may affect people's privacy.The council already has a system whereby, with their consent, the council collects data from wi-fi-users at its offices, buildings, libraries and leisure centres and uses it for marketing purposes, such as promoting events.Now, as part of this new scheme in partnership with the Welsh government, the council is able to track wi-fi-users' mobile phones in Mostyn Street by triggering sensors.The data collected contains no personal information, but gives the council a picture of movements around the street by tracking a device's media access control (Mac) address.Discussing the matter at a scrutiny committee meeting, Mr Saville questioned whether people's personal information was at risk from the scheme.""I appreciate you are not capturing any personal data, but if we think, smartphones, and most people will only have one, the Mac address, the identifier in many cases, is unique,"" he said.""So let's say I go down Mostyn Street, you are not able to tell who I am personally, my age, my other details, but you know where my phone has been, and someone would be able to link that to an individual wouldn't they, potentially?""Conwy council IT manager Neil Payne replied: ""Potentially, yes, if we had details of your phone contracts, which we don't have, or if you went to the mobile phone providers.""But he added: ""The initial purpose of it is to monitor footfall. So all it does is picks up what we call a Mac address, a unique address, no personal details at all, and it just tracks the movement of those phones.""Kinmel Bay councillor Nigel Smith dismissed Mr Saville's arguments as ""scaremongering"".""I couldn't find out what councillor Harry's Mac address is if I wanted to,"" Mr Smith said.""That's the truth of the matter. I could quite easily go out and look at a registration on a car and monitor where that car goes, and nobody worries about that.""The committee voted against Mr Saville's proposal to stop the pilot."
'We haven't had a single penny from the Post Office',20:59 8 Dec,https://ichef.bbci.co.uk/live-experience/cps/320/cpsprodpb/17DE2/production/_127926779_sethi2.jpg,https://www.bbc.com/news/business-63889700,"Baljit Sethi cannot understand why it is taking so long for the Post Office to pay him compensation.""It doesn't seem like they're interested in doing anything,"" he says.He is one of thousands of sub-postmasters who lost everything, after the introduction of a faulty IT system made it appear as though money was going missing.The official inquiry into the scandal was looking into the compensation process for a third time on Thursday.The inquiry heard from government, Post Office and legal representatives, after its chairman Sir Wyn Williams said in September he was ""disappointed with the apparent lack of substantial progress to date"".The Post Office, which administers the compensation schemes, said it recognised the ""importance of ensuring that postmasters receive timely and fair compensation for the failings associated with the Horizon IT system"" and pointed to the numbers of people who had already received payments.The government says ""significant progress"" has already been made on compensation and has announced details of an additional compensation scheme that will begin work next year.But solicitors for sub-postmasters making claims say the process is too slow.Mr Sethi agrees that three years after the High Court declared the Post Office's Horizon IT system was riddled with ""bugs, errors and defects"", it is high time that people like him are properly compensated.""We haven't had a single penny,"" he says.""We've sent them so many emails, and after four or five months they reply: 'Please have patience, Mr Sethi'.""""I mean, how long can I have patience for?"" he says.Over 20 years Mr Sethi and his wife ran two post offices near Romford in east London, investing in the businesses and working long hours.He noticed the new IT system was causing shortfalls in the accounts at one of his two branches. He alerted the Post Office, but nothing was done. After ongoing erratic results from the Horizon accounting software, he lost his businesses, became bankrupt, and his reputation in the local community was destroyed. He ended up working as a low-paid night security guard, struggling to make ends meet.Other sub-postmasters were prosecuted, some spent time in prison, or had to pay back tens of thousands of pounds that they were wrongly accused of stealing.Some former sub-postmasters have suffered other financial consequences.Stefan Fountain, 65, decided to sell up and leave after his Post Office accounts started to show shortfalls, but that left him in ""an awful situation financially"".He was declared bankrupt, and ended up losing his home, and is now living in rented accommodation.Mr Fountain still owed money to creditors, and he has been told that £20,000 of his damages will go to official receivers, leaving him with £4,000.""I get quite angry and bitter when I think about it, as I've had to struggle all of my life due to the failings of the Horizon system, and yet still I am treated like this,"" he said.A Post Office spokesperson said: ""We are sincerely sorry for the impact of the Horizon scandal on the lives of victims and their families.""The Post Office, which is state-owned, runs two compensation schemes. One, the Historical Shortfall Scheme (HSS), is for people like Mr Sethi, former postmasters who had to cover discrepancies in their businesses' accounts with their own funds, but who were not prosecuted.A Post Office spokesperson said there had been over 2,300 eligible applications for the HSS.""Over 70% of applications have accepted an offer and received payment; and 95% of applicants should receive an offer by the end of this year. The scheme has also been extended to anyone who wants to submit a late application,"" he said.The Post Office said if outstanding applications had not received an offer, it was ""usually in light of a case-specific complexity"".A second scheme, the Overturned Historical Convictions (OHC) scheme, provides payments to those who were prosecuted. So far £11.3m has been paid in compensation to 77 of the 83 individuals whose convictions had been overturned, although much of that is in interim payments, and only two cases have been fully settled.The Post Office said it was ""making good progress with many more claims"".On Wednesday the government outlined the details of a third scheme, to be overseen by the Department for Business Energy and Industrial Strategy (BEIS).The new scheme will compensate the 555 former sub-postmasters who brought the initial legal action, known as the Group Litigation Order (GLO), that culminated in 2019 with a settlement at the High Court, making clear for the first time the scale of the miscarriage of justice that had taken place.Those 555 sub-postmasters did receive a share of the £57m original settlement, but that was mostly absorbed by legal fees and for legal reasons the GLO group are not eligible for either of the two Post Office-run compensation schemes.The new scheme would ""ensure that these trailblazing postmasters, who did so much to uncover this injustice, receive the compensation they deserve"", Business Secretary Grant Shapps said.But solicitors representing the former postmasters said their clients were ""justifiably frustrated"" at the delays to authorising settlements.Hudgell Solicitors, in a submission ahead of Thursday's inquiry hearing, highlighted the low initial offers that some claimants were receiving, which were increased three-fold or more when challenged. The delays in the process put ""great pressure"" on claimants in financial hardship to accept the initial offer, the firm said.Howe and Co accused BEIS of ""inertia"", only making fast progress with the new compensation scheme in the build-up to a hearing at the inquiry. The HSS scheme was ""exceptionally slow"" the firm said.That has certainly been Mr Sethi's experience.He made his initial application in February 2020. Since then he has answered hundreds of questions, but still received no substantial response.Mr Sethi's son Adeep is doing his best to help his parents to keep battling through what he says is a very opaque process.""These people are in their 70s and 80s, they're sick and tired of fighting,"" he says. ""They don't want the spectre of the Post Office haunting them any further."""
Striking use of Holyrood’s tax powers,19:00 8 Dec,https://ichef.bbci.co.uk/live-experience/cps/320/cpsprodpb/102A5/production/_127931266_adfb06be5da005fdaebb0b42c6569e6becdef45c.jpg,https://www.bbc.com/news/uk-scotland-63904942,"Like an advent calendar of pay disputes, there's someone on strike in public services every day until Christmas, and they go on into the New Year.Open today's door and you'll find Scottish teachers. Then it's Royal Mail, again.Next week, rail workers return to strike action, along with driving test examiners in Scotland, and Highlands and Islands airport staff.Just ahead of Christmas, Glasgow is one of the airports where inbound passengers will find hold-ups due to striking Border Force officials.Among the most controversial and consequential stoppages will be nurses and paramedics in England.Why the public services? Here are three reasons:Private sector employer, who are employers struggling to recruit and retain the workers they need, have more flexibility to put up pay in response - and are able to pass on at least some costs to customers.The most recent figures from the Office of National Statistics show average public sector pay rising 2.2% in the year to the July to September quarter, while private sector pay was up 6.6%, not including bonuses.Taking inflation into account, both sectors were worse off, but those in government service by much more. And since those pay figures for late summer, consumer price inflation has risen steeply, meaning real earnings will likely be shown to be further down.Today at Holyrood, Scottish trade unions have been lobbying for bigger pay rises next year. Most of the disputes taking place now are for pay rises in this current 2022-23 financial year.However, today's focus is on the public sector pay policy to be announced next week by John Swinney, the interim finance secretary, alongside his draft budget for 2023-24.While sympathetic to public sector workers, Scottish ministers point to the cuts Mr Swinney has had to apply to non-payroll services in order to enhance pay offers. But further pay claims are ""not affordable"", says the Scottish government.This being pantomime season, the answer from the Scottish Trades Union Congress (STUC) this week is ""oh yes they are… and here's how…""The umbrella body for labour unions has published an analysis of what powers the Scottish government has to raise more funds in tax, and how much they could bring in.This is a sort of reverse engineering of public finance. It starts with a hope for at least a 12% increase in the public sector payroll budget, just ahead of price inflation, and then finds ways that could be funded.To those who like taxes, particularly those who like raising taxes and in progressive ways, that journey makes for quite an exhilarating read. For those on higher earnings or with a lot of wealth in physical, financial or pension assets, it might be wise to take a seat before reading on.To get to the kind of funds the STUC has in mind to fund its pay demands, its report - compiled by economic modellers at Landman Economics consultancy - starts by finding ways the public payroll could partially pay for itself.From higher pay for public sector workers come higher income tax receipts for the Scottish government, and higher National Insurance contributions for the UK one.So while pushing up the public payroll bill by 10%, or £2.4 billion, the net cost to the Scottish government can be seen as 76% of that or £1.8 billion. And including the payback to the UK government coffers, the net cost falls to 57% of the gross figure, or £1.4bn.Then the tax increases begin, starting with the Scottish government's main fiscal lever, income tax.The freezing of thresholds is a form of stealth tax as people's earnings rise through them. They look likely to remain frozen next year in Scotland, as they are doing with Jeremy Hunt at the UK Treasury. With high inflation, that 'fiscal drag' brings in vast amounts of money with minimum political pain.But the union paper goes further, looking to reduce the higher rate threshold from £43,663 to £40,000, meaning the net goes wider still.With rates on above-average earnings already one penny in the pound higher than the rest of the UK, the STUC paper suggests that rises to three pence more. So higher rate tax, currently paid on earnings above £43,663, would go up from 41 pence in the pound to 43 pence.The threshold for top or 'additional' rate tax would fall to take in earnings above £125,000, while the rate rises to 48%. And a further tax band would kick in from £75,000, at a 46% rate.How much could that bring in to the Scottish government budget? A lot depends on how people respond.High earners have bigger incentives, and better accountants, with which to switch earned income to unearned dividends (taxed from Westminster), so there would be a 'behavioural effect'.But it's very hard to say how big that would be. The more taxes rise, the bigger it would be.This modelling arrives at a figure of £387m from lowering the higher rate threshold by £3,663. The new band, between £75,000 and £125,000 could bring in £200m.Adding two pence in the pound to that rate and the ones above could bring in £220m. And with some more gains elsewhere - modest because there aren't that many very high earners in Scotland - the total comes to £867m.The modelling further suggests that the top 10% of earners in Scotland would be nearly 3% worse off. That's from the income tax measures. There are plenty more ideas for squeezing the rich.Council tax, for instance, is widely acknowledged as being ripe for reform and far from progressive. The proportion of income paid by low income households on income tax is higher than the proportional impact on those paying council tax on big homes.Measures that could be introduced swiftly would be slashing the reduced council tax rates on second and holiday homes, as well as empty properties. Then slap a surcharge on the most valuable quarter of homes, or perhaps those valued at more than £500,000.That could be progressive on those in the top half of earners, but oddly, it would not be progressive in the lower half. Some in big homes have low income.Longer term, by which they mean it's possible by 2025, council tax could be replaced by a Proportional Property Tax, meaning bills are directly related to the value of the property. Something similar was proposed 16 years ago by an independent review commissioned by Labour ministers from a panel led by a senior banker.So, for example, if everyone pays 0.7% of the value of their home, that's nearly £1,500 a year on the average owner-occupied home. And the STUC/Landman reckoning is of nearly £1bn more income than council tax currently generates. For a house worth £1m, that means a £7,000 annual bill, which is a lot more than the owner is currently paying.But they're not finished with the high earners and wealthy yet. The jackpot of STUC tax reforms would be a wealth tax.The illustrative examples suggest that one in eight households have wealth of more than £1m. Get each of them to pay 1% in cash each year, even though some are cash poorer, and the annual bill would be shy of £8,000 per average house, bringing in £1.3bn.Or try setting the threshold at £2m in wealth, which would mean tax bills averaging nearly £18,500 for 2.2% of households, bringing in an extra £500m annually.Or push it up to £10m - the seriously wealthy, and only 0.1% of households. A 1% tariff would mean a bill of £74,000 per year, and £55m for public coffers.But it's at those levels of wealth, along with higher council tax and much higher income tax that you would see most behavioural effects - tax avoidance by clever accounting, moving out of Scotland, or not moving into it.Administrative costs, it is acknowledged, would be high - perhaps 1% of takings, if a register of wealth is to be reliable. And there's a further big catch. The STUC 'fairer tax' paper takes the powers the Scottish government already has, which is intended to deny ministers the opportunity to point the finger of blame and responsibility at Westminster.The Scottish government could not introduce a wealth tax under its current powers. Yet it could empower local councils to do so. And that would make it a much more politically and administratively complex challenge.The STUC isn't finished there. It has briefer suggestions of a Land Value Tax applying to businesses, while scaling back the Small Business Bonus tax holiday for the past 14 years. It is at growing cost in revenue foregone, and with little to no evidence that it makes much difference to economic or employment growth.There's encouragement for use of tourist taxes and a frequent flyer levy is suggested on top of passenger tax.And if some of those are more difficult to introduce next financial year, the report points to council reserves as a short-term piggy bank to be raided ahead of these new sources of revenue coming on stream.Would this plan work? It would be very challenging to introduce, and could be laden with unintended consequences for economic growth and total tax revenues, perhaps going far beyond the assumptions in the economic modelling used.It is an audacious pitch that all of this extra revenue should be shovelled into the bank balances of public sector workers, and not into other elements of public funds, such as welfare benefits or capital spending on better quality infrastructure.Politically, though, it's a clever move by the unions, as an answer to those who say their pay demands cannot be funded, and to those who say Holyrood lacks tax levers. But it's not the unions who would have to persuade voters to back such a plan at an election."
