Titles,Date&Time,Images_URL,Article_links,Article_conetent
What happens if I can't afford to pay my mortgage?,17:08 8 Dec,https://ichef.bbci.co.uk/live-experience/cps/320/cpsprodpb/16212/production/_127624609_6a288c64-943d-4836-80be-1ca5b49c8741.jpg,https://www.bbc.com/news/business-63486782,"The average interest rate charged by mortgage lenders is near its highest level for 14 years, adding to cost-of-living pressures.So what can those struggling to make repayments do - and how must their mortgage provider help out?There are different types of mortgages - all of which have become more costly in recent months.Mortgage rates have been rising, so the 1.6 million people on tracker or variable deals have been paying much more than a year ago.The estimated 300,000 homeowners coming to the end of a fixed deal every three months are also facing a much higher monthly bill.Typically, they could end up paying an extra £3,000 a year, the Bank of England said.That is difficult to answer. Analysts expect Bank of England interest rates to peak at about 4.75% next year.For anyone on tracker deals, at least, that means higher repayments to come.Recent data indicates that rates on fixed-rate deals have fallen slightly in recent weeks.House prices have also started to fall as higher interest rates put off buyers.In November, prices fell 2.3%, the biggest monthly reduction for 14 years, according to the Halifax.However, a decade or so of ultra-low mortgage rates - which many homeowners have become accustomed to - is clearly over.There is a smaller choice, but still plenty of options depending on your circumstances.An agreement between lenders, the Treasury and regulators means that people can switch to a new fixed-rate mortgage, without a new affordability test, when your current deal ends as long as you are up to date with payments.A shortfall equivalent to two or more months' repayments means you are officially in arrears.But your lender must make reasonable attempts to reach an agreement with you.In fact, the Financial Conduct Authority (FCA) - which regulates mortgage lenders - wrote to chief executives during the summer, reminding them they must treat customers fairly.Crucially, customers must contact their lender as soon as they realise they are going to struggle to make repayments - the earlier the better. Trained and experienced staff must be on hand to help.Within 15 working days of falling into arrears, your lender must:Your lender must then treat you fairly by considering any requests about changing how you pay, perhaps with lower repayments for a short period.Any arrangement you come to, the FCA points out, will be reflected on your credit file - affecting your ability to borrow money in the future - as will any missed payments.Your lender might also suggest or allow you to extend the term of the mortgage or let you pay just the interest for a certain period of time.A mortgage payment holiday enables customers to delay repayments - but not indefinitely.Lenders may offer this option, depending on individual circumstances - and not to those already in arrears - but the level of support offered during the Covid pandemic has been reduced.Again, this will show on your credit file.The devolved governments run some mortgage-support schemes - but the criteria can be complex. Here is a guide from the government-backed Moneyhelper website.Some people may decide to sell their home and - in extreme circumstances - the lender could take court action to repossess it.Repossessions are far rarer than they used to be.There are lots of stages before a lender can take such action and the whole process takes about two years.But if you think your home is at risk, it is well worth getting free, independent debt advice."
What are my rights if my flight is cancelled?,16:57 8 Dec,https://ichef.bbci.co.uk/live-experience/cps/320/cpsprodpb/17154/production/_124984549_gettyimages-1311837740.jpg,https://www.bbc.com/news/business-61646214,"Strike action by airport border staff is likely to cause disruption this winter, following problems for many holidaymakers flying last summer.Although airlines say that all flights are expected to operate as normal, passengers have been told to expect delays and cancellations.So what are your rights?If your flight is covered under UK law, your airline must let you choose between either getting a refund or an alternative flight, regardless of how far in advance the cancellation was made.You can get your money back for any part of the ticket you have not used. So if you booked a return flight and the outbound leg is cancelled, you can get the full cost of the return ticket refunded.If you still want to travel, your airline must find you an alternative flight. If another airline is flying to your destination significantly sooner, or there are other suitable modes of transport available, then you have a right to be booked onto that alternative transport instead.If you are stuck abroad or at the airport because of a flight cancellation, airlines must also provide you with other assistance until you are able to fly to your destination.This includes:If your airline is unable to arrange assistance, you have the right to organise this yourself and claim back the cost later. In this case, the Civil Aviation Authority advises people to keep receipts and not spend more than necessary.You are entitled to the same assistance if your flight is delayed by more than two hours.You may also be able to claim compensation if your flight arrives at its destination more than three hours late. Again, the amount is based on how far you are flying.If you are delayed by more than five hours and no longer want to travel, you can get a full refund.Disruption caused by things like extreme weather, airport or air traffic control employee strikes or other ""extraordinary circumstances"" are not eligible for extra compensation.However, in other circumstances - which are the airline's fault - you have a number of rights under UK law if you are flying from a UK airport on any airline, arriving at a UK airport on an EU or UK airline, or arriving at an airport in the EU on a UK airline.What you are entitled to depends on what caused the cancellation and how much notice you were given.If your flight is cancelled with less than two weeks' notice, you may be able to claim compensation based on the timings of the alternative flight you are offered.The amount you are entitled to also depends on how far you were travelling. For example:If you booked a package holiday with a company that is an Abta member and your flight is cancelled, you are entitled to a suitable alternative flight or a full refund."
What is happening to house prices?,16:39 8 Dec,https://ichef.bbci.co.uk/live-experience/cps/320/cpsprodpb/114C1/production/_127494807_houseprices_gettyimages-1326578802.jpg,https://www.bbc.com/news/explainers-63147101,"Annual house price growth has slowed, and the latest monthly figures from both Nationwide and Halifax show a fall.This follows the Bank of England's decision to increase interest rates to 3%, meaning higher mortgage costs for many.In the last two years, prices rose steeply - by about a quarter - across most of the UK.That pace of growth was much faster than was seen after the 2008 global financial crisis, when houses lost about a sixth of their value. It took five years, on average, for prices to recover.However, prices have now started to slow, with figures from both Nationwide and Halifax showing falls between October and November.The chart above of annual, rather than monthly, growth shows that year-on-year growth is heading down towards zero.Nationwide warned the housing market looked set to ""remain subdued"" in the coming months.Monthly changes can be blips, but the UK's largest lender, Lloyds, is planning for an 8% fall next year.In November, the Office of Budget Responsibility (OBR), which advises the government on the health of the economy - predicted that house prices will drop by 9% over the next two years.Big jumps in interest rates put pressure on the amount people can afford to offer for houses, and that means less demand.Mortgage affordability also depends on wider cost-of-living pressures like energy bills, wages and job security. The future of house prices depends on the economy as a whole.The biggest immediate effect is on people who want to move.Some sellers may decide to delay putting their homes on the market. Homeowners who are considering moving may find they have less money to spend.There were fewer property sales this year than in the 12 months leading up to last summer's surge in prices before the temporary stamp duty reduction ended.But if interest rates stay high, an increasing number of people will come off fixed-price mortgages (about 100,000 each month) to new, higher rates.Some homeowners will find higher these monthly payments unaffordable, making them more likely to sell.First-time buyers may find properties are more affordable, allowing them to get a foot on the ladder - assuming they can get a mortgage.But a drop in prices can also send shudders through the finances of homeowners who are staying put.At the most extreme, they can end up in negative equity - where the amount they have borrowed is greater than the current value of their property.With about a third of household wealth tied up in home values, falling prices can make people feel less financially secure, mean they save more than they spend.Less spending can make an economic slowdown even worse.Arrears peaked during the 2008 financial crisis, and did not rise significantly during the pandemic, helped by lenders granting payment holidays.Payment difficulties can lead to banks and building societies repossessing houses, although lenders try to avoid this.More than 200,000 properties were repossessed in the five years after the 2008 crash.As a result of Covid, repossessions were suspended between March 2020 and April 2021. In the year after they restarted, there were fewer than 4,000.When the Bank of England raised interest rates by 0.75 percentage points to 3% on 3 November, it was the biggest single rise in the cost of borrowing since 1989.After the mini-budget, financial markets were forecasting that the Bank of England's interest rate would rise above 6% in 2023.However, traders now expect the peak to be under 5%. You can use the mortgage calculator above to see how rate changes affect monthly repayments.In the early 2000s property boom, 100% mortgages and cashback offers were not uncommon.But after the 2008 financial crash, mortgage lending rules were tightened.As a result, loans should leave more room for prices to fall before borrowers are stuck with negative equity.Most recent borrowers have also had their ability to pay checked against interest rates even higher than the ones we're seeing at the moment.Additional reporting by Jack Rodgers and Helena Rosiecka"
NI economy expected to shrink next year,12:07 8 Dec,https://ichef.bbci.co.uk/live-experience/cps/320/cpsprodpb/10729/production/_124996376_cash.getty.png,https://www.bbc.com/news/uk-northern-ireland-63893672,"Ulster University economists expect the Northern Ireland economy to shrink next year, followed by a weak recovery in 2024.The Ulster University Economic Policy Centre (UUEPC) estimates that output will fall by 1.2% in 2023.The forecast for 2024 is growth of 1.7%, with a similar outlook for the UK as a whole.It also suggests that the Bank of England may not raise interest rates much beyond the current 3%.UUEPC director Gareth Hetherington said that a further increase in interest rates this month is ""almost inevitable"" but future increases could be smaller and ""we may be approaching the end of the current cycle of monetary tightening"".Interest rates were just 0.25% at the start of this year but have been raised steadily as the Bank of England has tried to get on top of soaring inflation.Mr Hetherington said the last Bank of England monetary policy committee report included analysis that suggests inflation could fall to below its 2% target over three years, even if rates stay at 3%.""This would suggest that interest rates may not need to go any higher, but the report also stressed that risks were skewed towards higher inflation,"" he added.The UUEPC forecasts that interest rates will be 3.5% at the end of 2022 and 2023 with inflation averaging 7.4% next year."
First King Charles 50p coins enter circulation,5:42 8 Dec,https://ichef.bbci.co.uk/live-experience/cps/320/cpsprodpb/177AA/production/_127407169_king_charles_50p_pa_2.jpg,https://www.bbc.com/news/business-63888781,"Millions of 50p coins bearing the image of King Charles III will enter circulation from Thursday via post offices across the country.They are the first mass-produced coins carrying the new King's image, and will be given out in change to customers.An estimated 4.9 million of the new coins are being distributed to post offices - about half of the total number earmarked for circulation.Coins carrying the image of the late Queen will still be accepted in shops.""Today marks a new era for UK coinage, with the effigy of King Charles III appearing on 50ps in circulation,"" said Rebecca Morgan, director of collector services at The Royal Mint.""We anticipate a new generation of coin collectors emerging, with people keeping a close eye on their change to try and spot a new 50p that bears the portrait of our new King.""The coin has been struck at The Royal Mint in Llantrisant, Wales, using an image of the King produced over the course of months by sculptor Martin Jennings.He used pictures of King Charles on his 70th birthday to create a likeness of the monarch, in what is the smallest work he has ever had to produce. He described its production and distribution as a ""quite remarkable experience"".The first batch of coins will be given in change to customers buying something in post offices - something its chief executive Nick Read describes as a ""tremendous honour"".""December is our busiest time of the year so the coin will be entering our network in a phased manner,"" he said. ""If you don't receive the new 50p in your change on your first visit to a post office you may well get it in your change in a subsequent visit, so keep a look out for it.""More coins will be released in line with demand, replacing damaged or worn 50p coins carrying the portrait of Queen Elizabeth. There are approximately 27 billion coins circulating in the UK bearing the image of the late Queen and these can still be used to pay for things. Before decimalisation, it was common for people to carry coins featuring different monarchs in their pockets.Cash use has become far less frequent when compared to debit cards, a trend driven by the emergence of contactless cards and then accelerated by the Covid pandemic. The buying power of these coins has also been diluted by rising prices.However, there is still keen interest from consumers and collectors about the images used on coins and banknotes.The reverse side of the new 50p coin is a copy of the design used on the 1953 Crown struck to commemorate the Queen's coronation.It includes the four quarters of the Royal Arms depicted within a shield. In between each shield is an emblem of the home nations: a rose, a thistle, a shamrock and a leek.The coins follow centuries of tradition with the monarch now facing left - the opposite way to his predecessor. Profiles are alternated between left and right for successive monarchs. As with previous British kings, and unlike the Queen, he wears no crown.Other denominations will be manufactured, carrying the King's image, in line with demand."
Evri apologises for pre-Christmas parcel delays,0:21 8 Dec,https://ichef.bbci.co.uk/live-experience/cps/320/cpsprodpb/236F/production/_127917090_evri-index-getty.jpg,https://www.bbc.com/news/newsbeat-63874415,"If you've been waiting ages for an online order to arrive, you're not alone.Companies including ASOS, H&M and JD Sports have been getting hundreds of tweets asking: ""Where's my stuff?""A lot of anger seems to be aimed at courier Evri, with some complaining of packages stuck at depots for a week or more.It says it's delivering more than 3 million parcels daily and working to get items to people before Christmas.But quite a few customers say they've not been among those lucky ones and have faced ""unacceptable"" waits for items.A common complaint is that Evri's tracking tool says their order has been delayed - followed by no further updates for days.Others have complained of paying for next-day delivery and not getting it.And a few say their items have been marked as lost after going missing - only for their replacements to suffer a similar fate.Lucy Hall, 29, from South London, says her parcel containing her Dad's Christmas present has been stuck outside a depot for the past week and a half.She placed the order on 23 November.""I knew it was Black Friday coming up so it might arrive a bit later,"" she says. ""I got a confirmation email straight away from the seller so I thought it was all fine.""Then two days afterwards I saw a message saying Evri had the parcel - then I knew it wasn't going to go well.""Lucy would like sellers to declare which courier they work with - and says she would avoid buying from those using Evri in future online shopping.""I don't know if I'm ever going to get this parcel,"" she says. ""I've not been able to speak to a real human being just to explain what has happened.""I'm now thinking am I going to lose money if I have to buy it twice, or should I wait and risk my Dad not getting a Christmas present?""It's incredibly frustrating and it's extra stress I don't need.""What does Evri say?Evri - which used to be known as Hermes - told BBC Newsbeat it was ""sorry customers in certain local areas are experiencing short delays in receiving their parcels"".It said the delivery sector was experiencing higher than normal demand ""driven in part by the Royal Mail strikes"".Couriers for companies such as Evri have not gone on strike, but it's thought more sellers are using them while postal action continues.Evri also says it's experiencing ""final-mile staffing shortages"" - a lack of drivers - in some areas.Customers have complained that Evri's online help service is no use, and that getting hold of staff by phone or e-mail is extremely difficult.Evri says customers with concerns about a delivery should contact the seller first.The company adds that its local teams ""are working hard to ensure that any delayed parcels will arrive before Christmas"".BBC Newsbeat approached some major companies to ask what was going on with deliveries.Of those who replied, most said the sheer number of orders received during Black Friday was causing delays.JD Sports said carriers were seeing ""higher than expected volumes"" as a result of Royal Mail strikes but most of its deliveries were making it ""within expected timelines"".The company asked those with any concerns to contact its customer care team.That's also the advice from ASOS, where customers will currently see a warning on its website advising them to allow an extra 72 hours for parcels to arrive.Clothing retailer H&M declined to comment and The Hut Group, which includes brands such as MyProtein and Cult Beauty, has yet to provide a response.BBC Newsbeat also sent questions to PrettyLittleThing and BeautyBay but hasn't heard back.Citizens' Advice - which gives independent guidance on various topics - has a guide on your options if you don't receive something you've ordered.It also has a few tips to help people ensure deliveries are as pain-free as possible before you've placed an order.Many retailers offer multiple delivery options, with some charging more to use different, quicker services.You might also want to get more organised this year.With more postal strikes planned this month, the Royal Mail has urged people to send Christmas post early.If that is putting pressure on other delivery firms, you might not want to leave your online shopping to the last minute this year.Additional reporting by Emma Pengelly.Follow Newsbeat on Twitter and YouTube.Listen to Newsbeat live at 12:45 and 17:45 weekdays - or listen back here."
Juul agrees thousands of US vaping settlements,21:12 7 Dec,https://ichef.bbci.co.uk/live-experience/cps/320/cpsprodpb/EC41/production/_127918406_gettyimages-1142248658.jpg,https://www.bbc.com/news/business-63888206,"E-cigarette manufacturer Juul Labs is to settle more than 5,000 US vaping lawsuits, after being accused of targeting teenagers with its products.The deal was reached with about 10,000 plaintiffs in a California court. The financial terms have not been revealed.In September, the firm agreed to pay hundreds of millions to end a probe of its advertising.Juul has been accused of fuelling the rise in teenage vaping and has been forced to take cost-cutting measures.The firm has repeatedly denied targeting young people and has not admitted wrongdoing in previous cases.Critics point to the colourful packaging, variety of flavours and use of young models in their campaigns.In 2022, more than 2.5m US school students used e-cigarettes, according to the Centers for Disease Control and Prevention.Some of those involved in the case said that they were not aware that the product could be more addictive than cigarettes.Philip Federico, a lawyer who represented dozens of school districts in the case, described the settlement as a ""tremendous victory for school districts burdened by the vaping epidemic"".Juul itself said the settlement ""represent a major step toward strengthening Juul Labs' operations and securing the company's path forward"".In the earlier case, Juul agreed to pay $438.5m to settle claims it downplayed its products' risks and targeted underage buyers.The firm's products were briefly banned this year and in November Juul said it had secured investment allowing them to stay in business."
House prices see biggest drop in 14 years - Halifax,18:30 7 Dec,https://ichef.bbci.co.uk/live-experience/cps/320/cpsprodpb/1028D/production/_127398166_4cf6c3fe661d526a3e64a25a961c3fc9937e8294.jpg,https://www.bbc.com/news/business-63886983,"UK house prices saw their biggest drop in 14 years in November, falling 2.3%, reflecting ""volatility"" in the market, according to mortgage lender Halifax.November marks the third month in a row during which prices have fallen with potential buyers playing safe by delaying purchases.The average UK house price in November was £285,579.Higher mortgage rates, economic uncertainty, and the rising cost of living are all affecting the market.The annual rate of growth in property prices has now dropped from 8.2% to 4.7%.Kim Kinnaird, director of Halifax Mortgages, said: ""While a market slowdown was expected given the known economic headwinds - and following such extensive house price inflation over the last few years, this month's fall reflects the worst of the market volatility over recent months.""Some potential home moves have been paused as homebuyers feel increased pressure on affordability and industry data continues to suggest that many buyers and sellers are taking stock while the market continues to stabilise.""However, she said that the falls should be put into context, given the rapid increase in property prices in the last few years.Property prices were up more than £12,000 compared with this time last year, and £46,403 higher than in March 2020 when the Covid pandemic began.The Halifax said Wales and the South West of England had recorded particularly sharp slowdowns in annual house price growth.Both had been at the forefront of house price inflation during the pandemic, when the so-called race for space among buyers boosted demand for rural or coastal properties.The Halifax survey, based on the lender's own data, comes shortly after the rival Nationwide Building Society said prices fell 1.4% from October to November - the largest month-on-month fall since June 2020.Mortgage rates are much higher than at any time during the last decade, although earlier this week, the average rate on a new, fixed-rate two or five-year deal fell below 6% for the first time for two months.Tomer Aboody, director of property lender MT Finance, said: ""With another fall in property prices in November, buyers and sellers are clearly demonstrating more caution due to higher mortgage rates and the ever-rising cost of living.""As with any fall in pricing, buyer sentiment and confidence is key. But considering the macro-economic and seasonal factors affecting all consumers, along with the month-on-month increases seen over the past 18 months or so, the decline needs to be put into context as it is still minimal."""
